{
  "id": "6",
  "firstName": "Jackie",
  "lastName": "Prosacco",
  "role": "Analyst",
  "email": "zachariah.thompson@yahoo.com",
  "jobs": [
    "Developer",
    "Designer"
  ],
  "address": [
    {
      "town": "Palamaneru",
      "district": "Chittoor",
      "state": "Andhra Pradesh"
    },
    {
      "town": "Hyderabad",
      "district": "RangaReddy",
      "state": "Telangana"
    }
  ],
  "favFoods": [
    {
      "brakfast": "Idle",
      "lunch": "Biryani",
      "dinner": [
        "chapthi",
        "Milk"
      ]
    }
  ]
}